shipping_is_express,title_orig,product_url,badge_fast_shipping,badge_local_product,rating,merchant_id,title,rating_four_count,retail_price,rating_five_count,rating_two_count,merchant_title,price,product_id,shipping_option_price,merchant_rating,badge_product_quality,rating_one_count,badges_count,inventory_total,urgency_text,merchant_name,product_color,product_picture,countries_shipped_to,merchant_has_profile_picture,rating_count,tags,origin_country,units_sold,merchant_rating_count,product_variation_inventory,uses_ad_boosts,shipping_option_name,rating_three_count,merchant_info_subtitle,merchant_profile_picture,product_variation_size_id
0,Women's Summer Fashion Spaghetti Strap Floral Print Tie Front Mini Dress Sexy Dress,https://www.wish.com/c/5ea3b5bfa92d6c0442cd4b03,0,0,3.93,5533c83986ff95173dc017d0,Mode f√©minine √©t√© bretelles spaghetti imprim√© floral nouer devant mini robe robe sexy,12,7,27,2,shuilingjiao international trade company,8,5ea3b5bfa92d6c0442cd4b03,2,4.080890773644167,0,7,0,50,Quantit√© limit√©e !,shuilingjiaointernationaltradecompany,yellow,https://contestimg.wish.com/api/webimage/5ea3b5bfa92d6c0442cd4b03-medium.jpg,28,1,54,"Summer,Fashion,Floral print,Mini,Dress,Mini dress,Print,Women's Fashion,Sexy Dress,Floral,sexy,Spaghetti,Women Fashion",CN,1000,88193,19,1,Livraison standard,6,"87 % avis positifs (88,193 notes)",https://s3-us-west-1.amazonaws.com/sweeper-production-merchantimage/dp_5533c83986ff95173dc017d0.jpg,S
0,2019 Summer Plus Size Tank Top for Women Spaghetti Strap  Flower Print Sleeveless Casual Top (S-6XL),https://www.wish.com/c/5d00ccdde1fe9971cb8aef7a,0,0,4.06,5acaf29d5ebcfd72403106a8,2019 D√©bardeur grande taille √©t√© 2019 pour femme D√©bardeur d√©contract√© sans manches √† bretelles spaghetti imprim√© fleurs (S-6XL),303,8,894,92,Suyi Technology,9,5d00ccdde1fe9971cb8aef7a,3,4.045170200666179,0,129,0,50,Quantit√© limit√©e !,greatexpectationstechnology,beige,https://contestimg.wish.com/api/webimage/5d00ccdde1fe9971cb8aef7a-medium.jpg,23,1,1642,"Summer,Plus Size,Floral print,Tank,Tops,Spaghetti Strap,tank top,Women's Fashion,Flowers,Spaghetti,Print,sleeveless,Fashion,Casual,Women",CN,10000,12309,28,1,Livraison standard,224,"(12,309 notes)",https://s3-us-west-1.amazonaws.com/sweeper-production-merchantimage/dp_5acaf29d5ebcfd72403106a8.jpg,M
0,"Summer Women Jurassic Mom of Dino Tank Tops Casual Vest Don't Mess with MamaSaurus You'll Get Jurasskicked Funny Mom Shirt Sleeveless Blouse ",https://www.wish.com/c/5ca2f72d96d90c7ed661b692,0,0,4.02,584bcf7bfef409603f39b619,"Femmes d'√©t√© Jurassic Mom of Dino D√©bardeurs Casual Vest Don ' t Mess avec MamaSaurus Vous obtenez ' Jurasskicked chemise dr√¥le maman chemisier sans manches ",128,7,330,34,Chuanpu,7,5ca2f72d96d90c7ed661b692,2,4.018157135584592,0,54,0,50,Quantit√© limit√©e !,chuanpu,white,https://contestimg.wish.com/api/webimage/5ca2f72d96d90c7ed661b692-medium.jpg,41,1,636,"Summer,Vest,momshirt,Get,summer t-shirts,funnytop,yoga top,Tops,Women's Fashion,Fashion,Casual,Women,blouse,Funny,Tank,Shirt,graphic tee,sleevelessblouse,sportsamprecreation,Dinosaur,gymwear,sleeveless,casualblouse",CN,1000,35358,50,0,Livraison standard,90,"85 % avis positifs (35,358 notes)",https://s3-us-west-1.amazonaws.com/sweeper-production-merchantimage/dp_584bcf7bfef409603f39b619.jpg,S
0,Summer New 2020 Fashion Women's Slim Long Dress Plus Size Gradient Printed Sleeveless Soft and Comfortable Dress Beach Spaghetti Strap Dress Elegant Dress,https://www.wish.com/c/5eb763e728a61a40806afbff,0,0,3.4,58b011e82e27bf506cee1ace,√ât√© Nouveau 2020 Mode Femmes Mince Longue Robe Plus La Taille D√©grad√© Imprim√© Sans Manches Doux et Confortable Robe Plage Spaghetti Strap Robe √âl√©gante Robe,14,7,34,12,lovemom,8,5eb763e728a61a40806afbff,3,4.023291043363,0,16,0,50,Quantit√© limit√©e !,lovemom,grey,https://contestimg.wish.com/api/webimage/5eb763e728a61a40806afbff-medium.jpg,37,1,94,"slim long,slim dress,Fashion,Summer,Dresses,Beach,Dress,summer dress,long dress,Women's Fashion,slim,Spaghetti Strap,Elegant,beach dress,Plus Size,printed,Sleeveless dress,sleeveless,maxi dress,Spaghetti,Women",CN,1000,5281,50,0,Livraison standard,18,"85 % avis positifs (5,281 notes)",https://s3-us-west-1.amazonaws.com/sweeper-production-merchantimage/dp_58b011e82e27bf506cee1ace.jpg,S
0,Women Summer Printed Plus Size Loose Casual Trousers Harlan Pants Long Pants Plus  Size S-5XL,https://www.wish.com/c/5e3baa8d8f7db5003fb33026,0,0,3.54,5df71a34092d7302140be245,Women Summer Printed Plus Size Loose Casual Trousers Harlan Pants Long Pants Plus  Size S-5XL,3,10,5,2,simply spell,11,5e3baa8d8f7db5003fb33026,2,4.15593220338983,0,2,0,50,Quantit√© limit√©e !,simplyspell,black,https://contestimg.wish.com/api/webimage/5e3baa8d8f7db5003fb33026-medium.jpg,42,1,13,"Summer,trousers,pants,Bottom,fashion pants,Women's Fashion,Long pants,widelegpant,Casual,harem pants,summerpant,Plus Size,loosepant,printed,women trousers,slitpant,Women",CN,100,885,50,1,Livraison standard,1,88 % avis positifs (885 notes),https://s3-us-west-1.amazonaws.com/sweeper-production-merchantimage/dp_5df71a34092d7302140be245.jpg,XL
0,Women Fashion Casual Thai Harem Trousers Summer Hippy High Waist Pants Loose Yoga Pants,https://www.wish.com/c/5ec3838095806b23bae8412b,0,0,4.04,556425de56aea60ea1d17778,Femmes Mode Casual Thai Harem Pantalon D'√©t√© Hippy Pantalon Taille Haute Pantalon De Yoga L√¢che,13,3,22,4,changzhouzeranshangmaoyouxiangongsi,3,5ec3838095806b23bae8412b,1,4.093588281729673,0,2,0,50,Quantit√© limit√©e !,Â∏∏Â∑ûÊ≥ΩÁÑ∂ÂïÜË¥∏ÊúâÈôêÂÖ¨Âè∏,brown & yellow,https://contestimg.wish.com/api/webimage/5ec3838095806b23bae8412b-medium.jpg,29,1,47,"Summer,harem,trousers,Yoga,high waist,Casual pants,Long pants,pants,Waist,yoga pants,Women's Fashion,yoga leggings,harem pants,High Waist Pants,Fashion,sweat pants,Casual,Women",CN,100,11401,1,1,Livraison standard,6,"87 % avis positifs (11,401 notes)",https://s3-us-west-1.amazonaws.com/sweeper-production-merchantimage/dp_556425de56aea60ea1d17778.jpg,XXXS
0,Summer Women Fashion Floral Short Dress Spaghetti Strap Sweetheart Sheath Dress,https://www.wish.com/c/5d2eb8028c9c606b3e2f99cc,0,0,3.42,5541ba455252290c0b225b1f,Femmes d'√©t√© mode robe courte florale bretelles spaghetti ch√©rie robe fourreau,16,25,29,7,Higheight,13,5d2eb8028c9c606b3e2f99cc,3,3.9504034000864428,0,17,0,50,Quantit√© limit√©e !,higheight,rosered,https://contestimg.wish.com/api/webimage/5d2eb8028c9c606b3e2f99cc-medium.jpg,41,1,79,"Summer,sweetheart,Fashion,short dress,strappydres,goingout,Slim Fit,Floral dress,Shorts,Floral,Women's Fashion,Sheath Dress,A line dress,sweetheartdres,sexy,Above Knee dresses,Spaghetti,Dress,Women",CN,100,27764,50,1,Livraison standard,10,"(27,764 notes)",https://s3-us-west-1.amazonaws.com/sweeper-production-merchantimage/dp_5541ba455252290c0b225b1f.jpg,S
0,"Women Fashion Jumpsuit Short Romper V Neck Summer Playsuit Spaghetti Strap Halter Cute Beach Shorts Casual Solid Cami Rompers for Women ",https://www.wish.com/c/5e82bd24239e991c07f02bf7,0,0,3.37,561df3a23a698c711e5e5efa,"Women Fashion Jumpsuit Short Romper V Neck Summer Playsuit Spaghetti Strap Halter Cute Beach Shorts Casual Solid Cami Rompers for Women ",2,7,9,1,Double boutique,8,5e82bd24239e991c07f02bf7,3,3.9653373296700245,0,6,0,50,Quantit√© limit√©e !,doubleboutique,blue,https://contestimg.wish.com/api/webimage/5e82bd24239e991c07f02bf7-medium.jpg,41,1,19,"Summer,Plus Size,camishort,Halter,cute,Spaghetti,Necks,Spaghetti Strap,beach wear,playsuit,Casual,Women's Fashion,Shorts,playsuitoutfitsclothing,Fashion,Summer Fashion,Women,Beach,Rompers,Women Fashion,jumpsuit",CN,100,36033,50,1,Livraison standard,1,"84 % avis positifs (36,033 notes)",https://s3-us-west-1.amazonaws.com/sweeper-production-merchantimage/dp_561df3a23a698c711e5e5efa.jpg,S
0,ZANZEA Femme Casual Beach Col V Manche Courte Loose Plage Robe Dresse Maxi Plus,https://www.wish.com/c/5d5bb89494613054c04a2e21,0,0,3.46,58131ddf6f55296033923a7c,ZANZEA Femme Casual Beach Col V Manche Courte Loose Plage Robe Dresse Maxi Plus,9,84,23,3,vvfashion2016,11,5d5bb89494613054c04a2e21,3,4.201298485100716,0,13,0,50,Quantit√© limit√©e !,vvfashion2016,orange-red,https://contestimg.wish.com/api/webimage/5d5bb89494613054c04a2e21-medium.jpg,40,1,56,"pleated dress,robefemme,summer dress,V Neckdress,Casual,kleid,maternitydres,Party Dress,prom dress,maxi dress,Robes,Beach,loose dress",CN,100,90105,50,0,Livraison standard,8,"(90,105 notes)",https://s3-us-west-1.amazonaws.com/sweeper-production-merchantimage/dp_58131ddf6f55296033923a7c.jpg,M
0,New Fashion Summer Women Casual Dress Round Neck Loose Big Swing Skirt Sleeveless Soild Color Beach dress,https://www.wish.com/c/5e93d2215a3eed0c80ed2e56,0,0,3.74,5495976a40b3782bc8b3654a,Nouvelle mode d'√©t√© femmes robe d√©contract√©e col rond l√¢che Big Swing jupe sans manches Soild couleur robe de plage,11,10,23,3,OOWW FASHION,11,5e93d2215a3eed0c80ed2e56,3,3.9544430948124085,0,7,0,50,Quantit√© limit√©e !,ooww,black,https://contestimg.wish.com/api/webimage/5e93d2215a3eed0c80ed2e56-medium.jpg,41,1,54,"Summer,Fashion,Necks,Beach,Dress,Loose,beach dress,Round neck,Women's Fashion,sleeveless,Skirts,Casual,Women",CN,1000,73271,50,1,Livraison standard,10,"(73,271 notes)",https://s3-us-west-1.amazonaws.com/sweeper-production-merchantimage/dp_5495976a40b3782bc8b3654a.jpg,XS
0,Plus Size S-3XL New Women Fashion Loose Pants High Waist Ninth Pant Linen Trousers,https://www.wish.com/c/5cb02b41f8badd79e1c3a00b,0,0,3.3,578e0488ba8cd20e9b1b4a3b,Plus Size S-3XL New Women Fashion Loose Pants Pantalon ample taille haute Pantalon neuvi√®me pantalon Pantalon Pantalon en lin,170,5,326,125,Bruce Sky,5,5cb02b41f8badd79e1c3a00b,2,4.297335307179867,0,199,0,50,Quantit√© limit√©e !,brucesky,lightkhaki,https://contestimg.wish.com/api/webimage/5cb02b41f8badd79e1c3a00b-medium.jpg,32,1,1013,"trousers,high waist,Casual pants,pants,Women's Fashion,Long pants,pencil pants,Plus Size,loosepant,women trousers,Women,Fashion,Waist",CN,5000,13510,50,0,Livraison standard,193,"92 % avis positifs (13,510 notes)",https://s3-us-west-1.amazonaws.com/sweeper-production-merchantimage/dp_578e0488ba8cd20e9b1b4a3b.jpg,S
0,Women Lace See Through Sexy Lace up Low Waist Hollow Bikini Lingerie Set,https://www.wish.com/c/5a6f52aef718e05afa275acd,0,0,3.32,53e4bb20ff4d6d1b68bdb6d1,Femmes dentelle voir √† travers sexy lace up taille basse creux bikini ensemble de lingerie,83,9,181,58,bestwsih4u,3.67,5a6f52aef718e05afa275acd,1,4.070618245284286,0,111,0,50,Quantit√© limit√©e !,shenzhenfinejofashioncoltd,white,https://contestimg.wish.com/api/webimage/5a6f52aef718e05afa275acd-medium.jpg,111,1,510,"Lace Up,lacelingerieset,Lace,lowwaistunderwear,hollowoutlingerie,Waist,florallingerie,halterlingerieset,Women's Fashion,Bikini,Lingerie,women lingerie,Lingerie Sets,sexy,sexy lace,Bikini Lingerie,Women,sexy lingerie,laceuplingerie",CN,5000,253249,15,0,Livraison standard,77,"(253,249 notes)",https://s3-us-west-1.amazonaws.com/sweeper-production-merchantimage/dp_53e4bb20ff4d6d1b68bdb6d1.jpg,XL
0,Good Quality 2014 Summer Hot Sale Zipper Shorts Fashion Slim Men's Causual Ripped Jeans Cropped Trousers,https://www.wish.com/c/535530635aefb0555ba4351f,0,0,4.09,530306fe34067e3f15c41d87,Bonne Qualit√© 2014 √ât√© Vente Chaude Zipper Shorts Mode Slim Hommes Causual D√©chir√© Jeans Pantalon Court,289,21,897,74,ailla clothing,19,535530635aefb0555ba4351f,6,4.092913558578323,0,152,0,50,Quantit√© limit√©e !,litiannetworking,blue,https://contestimg.wish.com/api/webimage/535530635aefb0555ba4351f-medium.jpg,40,1,1561,"men jeans,Fashion,Summer,rippedjean,slim,croppedjean,mensummerjean,2014menshort,Men Shorts,zippers,Jeans,trousers,summerjean,Shorts,causaljean,rippedshort,2014summermenshort",CN,5000,9116,1,0,Livraison standard,149,"87 % avis positifs (9,116 notes)",https://s3-us-west-1.amazonaws.com/sweeper-production-merchantimage/dp_530306fe34067e3f15c41d87.jpg,26(Waist 72cm 28inch)
0,2019 New Fashion Women's Slim Plus Size Maxi Dress Ink Printing Spaghetti Strap Dress,https://www.wish.com/c/5dc3800976a1ec057a02a047,0,0,3.69,58b011e82e27bf506cee1ace,2019 nouvelle mode femmes mince plus la taille maxi robe impression √† l'encre robe √† bretelles spaghetti,356,10,985,156,lovemom,11,5dc3800976a1ec057a02a047,2,4.023291043363,0,343,0,50,Quantit√© limit√©e !,lovemom,red,https://contestimg.wish.com/api/webimage/5dc3800976a1ec057a02a047-medium.jpg,37,1,2160,"slim dress,dressesforwomen,halter dress,Dresses,Spaghetti,Plus Size,Spaghetti Strap,slim,Women's Fashion,Sleeveless dress,maxi dress,Fashion,Dress,Women",CN,20000,5281,50,0,Livraison standard,320,"85 % avis positifs (5,281 notes)",https://s3-us-west-1.amazonaws.com/sweeper-production-merchantimage/dp_58b011e82e27bf506cee1ace.jpg,S
0,Sexy Solid Ruffled Chiffon Sling Top Pure Color Women Summer Tank Top Plus Size,https://www.wish.com/c/5c879aba202e6b38cd317164,0,0,4.06,5660e53e769a564b3e3aeca0,Sexy Solid Solid Ruffled Chiffon Sling Top Pure Color Femme D√©bardeur d'√©t√© Taille Plus Grande,142,8,400,45,Fashion Trend Line,9,5c879aba202e6b38cd317164,3,3.9993714037038828,0,53,0,50,Quantit√© limit√©e !,Ê≥∑Áøî,orange,https://contestimg.wish.com/api/webimage/5c879aba202e6b38cd317164-medium.jpg,41,1,743,"Summer,Plus Size,ruffle,ruffled,chiffon,Tank,Pure Color,Cami,tank top,Women's Fashion,Fashion,V-neck,blousesampshirt,sexy,Tops,Women",CN,5000,20681,50,0,Livraison standard,103,"85 % avis positifs (20,681 notes)",https://s3-us-west-1.amazonaws.com/sweeper-production-merchantimage/dp_5660e53e769a564b3e3aeca0.jpg,S
0,5 Color Women's Fashion Summer Slim Sleeveless Camouflage Print Dress High Waist Lace Up Casual Pocket Mini Dresses Plus Size S-5XL,https://www.wish.com/c/5d2fd5a9af7a0c5b21369a05,0,0,4.16,55ed5a3362e273427107759e,5 Couleur Femmes De Mode D'√©t√© Mince Sans Manches Imprim√© Camouflage Robe Taille Haute √Ä Lacets Casual Poche Mini Robes Plus La Taille S-5XL,27,13,82,7,Oucho co. ltd.,13,5d2fd5a9af7a0c5b21369a05,3,3.9813366374970958,1,12,1,50,Quantit√© limit√©e !,ouchocoltd,pink,https://contestimg.wish.com/api/webimage/5d2fd5a9af7a0c5b21369a05-medium.jpg,41,1,138,"Summer,Plus Size,Lace,Mini,Dress,slim,camouflage,Mini dress,Pocket,high waist,Women's Fashion,Fashion,Lace Up,t,print dress,Print,sleeveless,bodycon,Casual,Women Fashion,Waist",CN,1000,12913,50,0,Livraison standard,10,"85 % avis positifs (12,913 notes)",https://s3-us-west-1.amazonaws.com/sweeper-production-merchantimage/dp_55ed5a3362e273427107759e.jpg,S
0,Summer Fashion Dabbing Pug T-Shirt Newest Men Funny T Shirts  Tops Hip Hop Tee,https://www.wish.com/c/591e8dcf49043a6ea25b1a31,0,0,4.52,5885a7e767f7c84d7657d220,Mode d'√©t√© Dabbing Pug T-Shirt Hommes les plus r√©cents T-shirts dr√¥les Tops Hip Hop Tee,64,38,216,9,Durax,9,591e8dcf49043a6ea25b1a31,3,4.380173035328046,1,7,1,50,Quantit√© limit√©e !,durax,white,https://contestimg.wish.com/api/webimage/591e8dcf49043a6ea25b1a31-medium.jpg,55,1,312,"Hip Hop,Summer,Fashion,Shirt,Funny,onecktshirt,Tops,summer t-shirts,Tee,Men's Fashion,Cool T-Shirts,T Shirts,Men T-shirt,Men,3dprintedtshirt,sizesxxxl",CN,1000,27740,50,0,Livraison standard,16,"94 % avis positifs (27,740 notes)",https://s3-us-west-1.amazonaws.com/sweeper-production-merchantimage/dp_5885a7e767f7c84d7657d220.jpg,S
0,ZANZEA Damen Sommer Mode Lose Rundhals Baumwolle Leinen 3/4 Arm Shirt Bluse Hemd Kleid Dress,https://www.wish.com/c/5b2a113209dce569672cc9f2,0,0,4.25,58131ddf6f55296033923a7c,ZANZEA - Damen Sommer Mode Lose Rundhals Baumwolle Leinen 3/4 Arm Shirt Bluse Hemd Kleid Dress,313,108,905,63,vvfashion2016,16,5b2a113209dce569672cc9f2,4,4.201298485100716,1,74,1,50,Quantit√© limit√©e !,vvfashion2016,red,https://contestimg.wish.com/api/webimage/5b2a113209dce569672cc9f2-medium.jpg,40,1,1524,"Fashion,Shirt,women dresses,Long Sleeve,plus size dress,Dress,pulloverdres,Women's Fashion,Midi Dress,maxi dress,kaftandres,plaidchecked",CN,10000,90105,50,1,Livraison standard,169,"90 % avis positifs (90,105 notes)",https://s3-us-west-1.amazonaws.com/sweeper-production-merchantimage/dp_58131ddf6f55296033923a7c.jpg,L
0,Women's Fashion Solid Summer Shorts Ladies Casual Short Pants Beach Shorts Plus Size XS-8XL,https://www.wish.com/c/5e95cf4cce38972f9c579599,0,0,3.72,5512b0d98e8def07a462e1d7,Mode f√©minine Solid Summer Shorts Ladies Casual Short Pants Beach Shorts Plus Size XS-8XL,12,6,19,4,Hello fashion store,7,5e95cf4cce38972f9c579599,2,4.1278391390540925,0,6,0,50,Quantit√© limit√©e !,hellofashionstore,green,https://contestimg.wish.com/api/webimage/5e95cf4cce38972f9c579599-medium.jpg,22,1,47,"Summer,Shorts,skinny pants,pants,women's pants,Short pants,summer shorts,Casual,harem pants,Women's Fashion,Plus Size,Sports Pants,Denim Shorts,high waisted shorts,Ladies,Beach,Fashion,pant womens summer",CN,100,17655,50,0,Livraison standard,6,"(17,655 notes)",https://s3-us-west-1.amazonaws.com/sweeper-production-merchantimage/dp_5512b0d98e8def07a462e1d7.jpg,XS
0,Summer Women Fashion Short Dress Sleeveless Waist Dress Camouflage Dress Bodycon Slim Fit Dress Plus Size XS-8XL,https://www.wish.com/c/5e956110d55c740fe1578225,0,0,4.19,54db03867851097093c0efe7,√ât√© Femmes Mode Robe Courte Sans Manches Taille Robe Camouflage Robe Moulante Slim Fit Robe Plus La Taille XS-8XL,10,7,33,2,fuzhoushicangshanqutiantuwenhuachuanboyouxiangongsi,8,5e956110d55c740fe1578225,2,3.851930136833908,1,5,1,50,Quantit√© limit√©e !,Á¶èÂ∑ûÂ∏Ç‰ªìÂ±±Âå∫Â§©È?îÊñáÂåñ‰º†Êí≠ÊúâÈôêÂÖ¨Âè?,pink,https://contestimg.wish.com/api/webimage/5e956110d55c740fe1578225-medium.jpg,21,1,54,"Summer,Plus Size,women dresses,Evening Dress,Dress,slim,casual dresses,Mini dress,beach dress,Fashion,sleeveless,summer dresses,casual dress,slim dress,Shorts,Waist,short dress,Slim Fit,Women's Fashion,camouflage,Sleeveless dress,t,women dress,Women",CN,100,8989,50,0,Livraison standard,4,"82 % avis positifs (8,989 notes)",https://s3-us-west-1.amazonaws.com/sweeper-production-merchantimage/dp_54db03867851097093c0efe7.jpg,XS
0,Sexy Women's Summer Casual Sleeveless Evening Party Backless Beachwear Mini Dress,https://www.wish.com/c/594c7f0082f9b070a355c94c,0,0,3.18,57c306d73a698c06f98ed450,Mini robe de soir√©e d√©contract√©e sans manches pour femmes,96,21,174,69,SKATE,6,594c7f0082f9b070a355c94c,2,4.113869950137377,0,137,0,50,Quantit√© limit√©e !,skate,rose,https://contestimg.wish.com/api/webimage/594c7f0082f9b070a355c94c-medium.jpg,34,1,573,"Summer,womens dresses,Mini,Patchwork,Dress,backlessbeachwear,Mini dress,beachdresse,Women's Fashion,Women S Clothing,soliddresse,party,backless,sexy,Casual,sleeveless",CN,5000,9827,13,0,Livraison standard,97,"(9,827 notes)",https://s3-us-west-1.amazonaws.com/sweeper-production-merchantimage/dp_57c306d73a698c06f98ed450.jpg,S
0,2019 Summer Fashion Women Sleeveless Lace Tank Top Spaghetti Strap Tops Casual Tank Top V Neck Shirt Plus Size,https://www.wish.com/c/5cd8e61e943cd76a7c2d0be0,0,0,3.19,58fde9517c09181253b0ef86,2019 Mode d'√©t√© Femme sans manches D√©bardeur en dentelle D√©bardeur Spaghetti Strap Tops D√©bardeur d√©contract√© D√©bardeur V Chemise col V Grande taille,44,6,77,19,mimily,7,5cd8e61e943cd76a7c2d0be0,2,4.012953645219998,0,66,0,50,Quantit√© limit√©e !,mimily,armygreen,https://contestimg.wish.com/api/webimage/5cd8e61e943cd76a7c2d0be0-medium.jpg,43,1,245,"Summer,strappytop,Plus Size,Lace,Shirt,Plus size top,tank top,Women's Fashion,Fashion,sleeveless tops,Casual T-Shirt,Spaghetti,summer tops,Women,lace trim,spaghetti strap top,Tank,Necks,Tops,Casual,Cami Tank Tops,sleeveless,deep v neck top,Loose tank tops",CN,1000,9341,50,0,Livraison standard,39,"(9,341 notes)",https://s3-us-west-1.amazonaws.com/sweeper-production-merchantimage/dp_58fde9517c09181253b0ef86.jpg,M
0,"Women‚Äôs Fashion Summer Casual Floral Printed V-Neck Sling Dress Bohemian Skirt High Waist Big Swing Dress ",https://www.wish.com/c/5cfdc9eaa9b0806c2f9aca41,0,0,4.4,5abb2cf26be8733b5bf6844f,"Women s Fashion Summer Casual Floral Printed V-Neck Sling Dress Bohemian Skirt High Waist Big Swing Dress ",16,7,57,4,maligoodsmart,4.73,5cfdc9eaa9b0806c2f9aca41,1,4.1174449226026075,1,3,1,50,Quantit√© limit√©e !,lazzyshop,green,https://contestimg.wish.com/api/webimage/5cfdc9eaa9b0806c2f9aca41-medium.jpg,35,1,86,"Summer,Fashion,high waist,Swing dress,long dress,Skirts,Dress,Waist,boho,V-neck,floralprinted,slingdre,bohemian,off shoulder,retro,Swing,Floral,printed,Women's Fashion,Casual,Women",CN,100,31138,1,1,Livraison standard,6,"88 % avis positifs (31,138 notes)",https://s3-us-west-1.amazonaws.com/sweeper-production-merchantimage/dp_5abb2cf26be8733b5bf6844f.jpg,S
0,Summer Fashion Trousers Women Leggings Ripped Pants Slim Pants Army Green Tights Pants,https://www.wish.com/c/5af406469be1de3b00f73128,0,0,3.76,53db691bd911395c8b2f92be,Pantalon de mode d'√©t√© Femmes Leggings Pantalon d√©chir√© Pantalon slim Pantalon vert arm√©e Collants,1502,14,3689,592,xiaomi,11,5af406469be1de3b00f73128,2,4.1371058558558556,0,1086,0,50,Quantit√© limit√©e !,xiaomi,black,https://contestimg.wish.com/api/webimage/5af406469be1de3b00f73128-medium.jpg,43,1,8029,"Summer,Leggings,trousers,high waist,Casual pants,Army,pants,Women's Fashion,pencil pants,Fashion,Green,Women,slim,Pants & Capris",CN,20000,17760,19,1,Livraison standard,1160,"88 % avis positifs (17,760 notes)",https://s3-us-west-1.amazonaws.com/sweeper-production-merchantimage/dp_53db691bd911395c8b2f92be.jpg,S
0,"Women Fashion Lace Party Cocktail Mini Dress Ladies Summer Short Sleeve Skater Dresses ",https://www.wish.com/c/5aba0e4d35ca8601538db9b5,0,0,4.28,5435ef5d01c0c057210e6b32,"Robe d'√©t√© √† manches courtes de patineuse pour dames avec mini-robe de cocktail en dentelle pour dames ",328,34,976,70,World Deal,16,5aba0e4d35ca8601538db9b5,5,4.23090311182634,1,76,1,50,Quantit√© limit√©e !,worlddeal,black,https://contestimg.wish.com/api/webimage/5aba0e4d35ca8601538db9b5-medium.jpg,39,1,1612,"Mini,womens dresses,Lace,Cocktail,slim dress,Dress,short sleeves,Mini dress,Women's Fashion,short sleeve dress,Summer,Party Dresses,princess dress,Bodycon Dress,Women,lace dresses,Shorts,Sleeve,Cocktail dresses,summer dress,Ladies,party,Fashion",CN,5000,228676,9,1,Livraison standard,162,"90 % avis positifs (228,676 notes)",https://s3-us-west-1.amazonaws.com/sweeper-production-merchantimage/dp_5435ef5d01c0c057210e6b32.jpg,M
0,Women Summer Fashion Tank Tops Sexy Sleeveless Crop Tops Casual Style Women Cotton Print Lace Stitching Irregular Blouse TopsÔºàXS-5XL),https://www.wish.com/c/5e16cb87e6dd7c03be24b28a,0,0,4.19,58ad449708de0c6dc59d9e06,Femmes d'√©t√© Mode D√©bardeurs Sexy Sans Manches Crop Tops Style D√©contract√© Femmes Coton Imprim√© Dentelle Coutures Irr√©guli√®res Blouse Tops ÔºàXS-5XL),14,2,50,4,hellohorse,2,5e16cb87e6dd7c03be24b28a,1,4.14695734747171,1,7,1,50,Quantit√© limit√©e !,hellohorse,green,https://contestimg.wish.com/api/webimage/5e16cb87e6dd7c03be24b28a-medium.jpg,35,1,81,"blouse,Summer,Plus Size,Tops & Blouses,Lace,Tank,Tops,topsamptshirt,tank top,Women's Fashion,Fashion,Loose,topsampblouse,Print,sleeveless,sexy,Women,Casual,Cotton",CN,1000,126370,1,0,Livraison standard,6,"89 % avis positifs (126,370 notes)",https://s3-us-west-1.amazonaws.com/sweeper-production-merchantimage/dp_58ad449708de0c6dc59d9e06.jpg,XS
0,Plus Size S-5XL Slim Fit Casual Classic Shorts Jeans Summer Sexy Women's Fashion High Waist Washed Denim Shorts,https://www.wish.com/c/5eb24bea7fc03e380f0509a1,0,0,3.78,53994751796f684b7f2193b5,Grande taille S-5XL Slim Fit Casual Classic Shorts Jeans √ât√© Sexy Femmes Mode Taille Haute Lav√© Shorts Denim,2,2,20,4,Clothes-Market,1.8599999999999999,5eb24bea7fc03e380f0509a1,1,3.9729373517265616,0,5,0,50,Quantit√© limit√©e !,qianshanlangweitradingcoltd,black,https://contestimg.wish.com/api/webimage/5eb24bea7fc03e380f0509a1-medium.jpg,42,1,36,"Women Pants,womens jeans,Fashion,Summer,Denim,slim,Hot pants,Women's Fashion,Plus Size,sexy,Casual,Slim Fit,Shorts,Waist,skinnyshort,Classics,Short pants,summerpant,Denim Shorts,high waist,solid color,Jeans",CN,1000,45524,50,1,Livraison standard,5,"85 % avis positifs (45,524 notes)",https://s3-us-west-1.amazonaws.com/sweeper-production-merchantimage/dp_53994751796f684b7f2193b5.jpg,XXXS
0,2019 Summer Ribbed Knitted Tank Top Cool Casual Plain Crop Top,https://www.wish.com/c/5c86009eab8dc14c1e679eb0,0,0,3.34,55d480c092e9ba1242bd816a,2019 D√©bardeur d'√©t√© en tricot c√¥tel√© en maille pour chandail d√©contract√© et d√©contract√© √† bretelles unies,44,5,80,23,cindy,5,5c86009eab8dc14c1e679eb0,2,4.094745422623526,0,48,0,50,Quantit√© limit√©e !,ÁéãÁÑïÁÑ?,blue,https://contestimg.wish.com/api/webimage/5c86009eab8dc14c1e679eb0-medium.jpg,41,1,252,"highwaisttop,Fashion,loosevest,Summer,loose shirt,Tank,Tops,knitted crop top,tank top,tank tops women,knitted,ribbed crop top,PLAINCROP TOP,Casual,cassualvest,solidblouse,tops for women",CN,1000,15948,15,0,Livraison standard,57,"87 % avis positifs (15,948 notes)",https://s3-us-west-1.amazonaws.com/sweeper-production-merchantimage/dp_55d480c092e9ba1242bd816a.jpg,XS
