shipping_is_express,title_orig,product_url,badge_fast_shipping,badge_local_product,rating,merchant_id,title,rating_four_count,retail_price,rating_five_count,rating_two_count,merchant_title,price,product_id,shipping_option_price,merchant_rating,badge_product_quality,rating_one_count,badges_count,inventory_total,urgency_text,merchant_name,product_color,product_picture,countries_shipped_to,merchant_has_profile_picture,rating_count,tags,origin_country,units_sold,merchant_rating_count,product_variation_inventory,uses_ad_boosts,shipping_option_name,rating_three_count,merchant_info_subtitle,merchant_profile_picture,product_variation_size_id
0,XS-8XL Plus Size Fashion Clothes Summer Dresses Women's Casual Sleeveless Beach Dress Gradient Color Cotton Dress Deep V-neck Off Shoulder Long Dress Ladies Loose Halter Party Dress,https://www.wish.com/c/5ea13adaa3cf3440f5d1605d,0,0,2.98,564b2fb5c126a0127af8441e,XS-8XL Plus La Taille V√™tements De Mode Robes D'√©t√© Femmes Casual Robe De Plage Sans Manches D√©grad√© Couleur Robe En Coton Col En V Profond √âpaule Longue Robe Dames L√¢che Halter Robe De Soir√©e,13,5,33,11,shenzhenshihuayanmaoyiyouxiangongsi,5,5ea13adaa3cf3440f5d1605d,2,3.9049418604651165,0,35,0,50,Quantit√© limit√©e !,Ê∑±Âú≥Â∏ÇÂçéË°çË¥∏ÊòìÊúâÈôêÂÖ¨Âè?,pink,https://contestimg.wish.com/api/webimage/5ea13adaa3cf3440f5d1605d-medium.jpg,20,1,102,"Deep V-Neck,Plus Size,halter dress,Halter,Summer,long dress,Dress,V-neck,beach dress,Party Dress,sleeveless,Casual,Clothes,maxide,Beach,summer dress,Women's Fashion,Cotton Dress,Sleeveless dress,Ladies,party,Cotton,Fashion,loose dress",CN,1000,10320,2,1,Livraison standard,10,"83 % avis positifs (10,320 notes)",https://s3-us-west-1.amazonaws.com/sweeper-production-merchantimage/dp_564b2fb5c126a0127af8441e.jpg,XS
0,Women Bikini Set Swimsuit Bikinis Halter Swimwear Women Beach Wear Bathing Suit Tankini Monokini,https://www.wish.com/c/5d2c298f71a914273558a31e,0,0,3.85,56e43d9e3a698c3826a5feff,Maillot de bain femme maillot de bain Bikinis Halter Maillots de bain femme Maillot de bain maillot de bain Tankini Monokini,257,7,550,86,good999,7,5d2c298f71a914273558a31e,2,4.179445442299057,0,129,0,50,Quantit√© limit√©e !,good999,black & blue,https://contestimg.wish.com/api/webimage/5d2c298f71a914273558a31e-medium.jpg,31,1,1193,"Bikinis Set,Womens Swimsuit,Halter,Bikini swimwear,women swimsuit,padded bikini,bandage bikini,Swimwear,swimsuits for women,Bikini,Suits,Women's Fashion,Fashion,Womens swimwear,high waist bikini,Halter Bikini,Swimsuit,Beach,Swimming,Women",CN,10000,17816,50,0,Livraison standard,171,"(17,816 notes)",https://s3-us-west-1.amazonaws.com/sweeper-production-merchantimage/dp_56e43d9e3a698c3826a5feff.jpg,XS
0,Summer New Women's Casual Dress Short Sleeve V-neck Loose Dresses Solid Color Dress Plus Size,https://www.wish.com/c/5d5f49662c026a13234062e7,0,0,3.28,5acaf29d5ebcfd72403106a8,Robe d√©contract√©e d'√©t√© √† manches courtes √† manches courtes pour femmes,29,6,44,17,Suyi Technology,7,5d5f49662c026a13234062e7,2,4.045170200666179,0,30,0,50,Quantit√© limit√©e !,greatexpectationstechnology,yellow,https://contestimg.wish.com/api/webimage/5d5f49662c026a13234062e7-medium.jpg,23,1,141,"sleeve v-neck,Summer,Plus Size,Sleeve,Dresses,Dress,short sleeves,V-neck,Women's Fashion,Shorts,solid color,knee,Fashion,Casual",CN,1000,12309,7,1,Livraison standard,21,"86 % avis positifs (12,309 notes)",https://s3-us-west-1.amazonaws.com/sweeper-production-merchantimage/dp_5acaf29d5ebcfd72403106a8.jpg,XS
0,Summer Beach Fashion Plus Size Women's Loose Short Sleeve Long Blouses Plus Size Deep V-neck Party Dress Ladies Casual Solid Color Beach Wear Swimsuit Cover-up Short Linen Dress,https://www.wish.com/c/5d29bc2e05b01018762aaea8,0,0,3.28,59aebfa350df6107c1eff8c8,Summer Beach Fashion Plus Size Femmes l√¢che manches courtes Blouses longues Plus Size Deep V-cou Party Dress Dames Casual Solid Color Beach Wear Maillot de bain Cover-up Short Linen Dress,25,30,64,18,naturalcolor,7,5d29bc2e05b01018762aaea8,2,4.382091743119266,0,42,0,50,Quantit√© limit√©e !,naturalcolor,white,https://contestimg.wish.com/api/webimage/5d29bc2e05b01018762aaea8-medium.jpg,109,1,179,"blouse,Plus Size,Summer,Dress,short sleeves,V-neck,beach dress,Fashion,Casual,Deep V-Neck,Shorts,Tops & Blouses,Sleeve,summer dress,Women's Fashion,Swimsuit,Party Dress,Ladies,party,linen dress,Beach,loose dress,Swimming",CN,1000,13625,50,1,Livraison standard,30,"93 % avis positifs (13,625 notes)",https://s3-us-west-1.amazonaws.com/sweeper-production-merchantimage/dp_59aebfa350df6107c1eff8c8.jpg,XS
0,Women Casual Loose Linen Trousers Solid Color Sport Yoga Comfortable Women Pants,https://www.wish.com/c/5cf608da188cc348c6d66b74,0,0,3.75,5556c60071e86d19fe7590d4,Pantalon de yoga sport couleur unie pour femme Pantalon confortable pour femme,264,7,537,91,Grace Style Fashion Store,6,5cf608da188cc348c6d66b74,2,4.055231102953446,0,159,0,50,Quantit√© limit√©e !,gracestylefashionstore,black,https://contestimg.wish.com/api/webimage/5cf608da188cc348c6d66b74-medium.jpg,31,1,1238,"Panties,sport pants,skinny pants,Casual pants,pants,yoga pants,Women's Fashion,Long pants,trousersforwomen,trousers,Sports Pants,women trousers,Yoga,Sport,Casual,trouserswomen,Women",CN,10000,5993,50,0,Livraison standard,187,"86 % avis positifs (5,993 notes)",https://s3-us-west-1.amazonaws.com/sweeper-production-merchantimage/dp_5556c60071e86d19fe7590d4.jpg,XS
