shipping_is_express,title_orig,product_url,badge_fast_shipping,badge_local_product,rating,merchant_id,title,rating_four_count,retail_price,rating_five_count,rating_two_count,merchant_title,price,product_id,shipping_option_price,merchant_rating,badge_product_quality,rating_one_count,badges_count,inventory_total,urgency_text,merchant_name,product_color,product_picture,countries_shipped_to,merchant_has_profile_picture,rating_count,tags,origin_country,units_sold,merchant_rating_count,product_variation_inventory,uses_ad_boosts,shipping_option_name,rating_three_count,merchant_info_subtitle,merchant_profile_picture,product_variation_size_id
0,Sexy Women One-Piece Push Up Bikini Bandage Monokini Swimsuit Bathing Swimwear,https://www.wish.com/c/56975d088b70437255bf8af8,0,0,3.64,53facca81c105e3d5866e212,Femmes sexy une pi√®ce push-up bikini bandage monokini maillot de bain maillot de bain,691,250,1342,301,GL,11,56975d088b70437255bf8af8,3,4.156715324661136,0,445,0,50,Quantit√© limit√©e !,gl,white,https://contestimg.wish.com/api/webimage/56975d088b70437255bf8af8-medium.jpg,47,1,3397,"Women,womenpaddedbra,summercasualfashionsexywomenprintbikinissetpushupbraswimsuitmidwaist,women swimsuit,onepiece,womensummersexybacklessbikini,Swimsuit,Swimwear,sexyswimwearset,Bikini,Fashion,fashionswimsuitswimwearbathingsuit,womenfashionsummerbikinisset,sexy,pushupbikiniset,fashionsweetladybeautywomenbikinisexyswimwear,Women's Fashion,summerbeachbikini,Swimming",CN,20000,402743,50,0,Livraison standard,618,"89 % avis positifs (402,743 notes)",https://s3-us-west-1.amazonaws.com/sweeper-production-merchantimage/dp_53facca81c105e3d5866e212.jpg,S
0,Summer Women Short Dress Sleeveless Waist Dress Camouflage Dress Bodycon Slim Fit Dress Plus Size XS-8XL,https://www.wish.com/c/5e9e8c496f15e20742bd4172,0,0,3.9,550ab2be8e8def0b2c654d4b,√ât√© Femmes Robe Courte Sans Manches Taille Robe Camouflage Robe Moulante Slim Fit Robe Plus La Taille XS-8XL,7,7,9,0,ELIM fashion store,8,5e9e8c496f15e20742bd4172,3,4.3183153770812925,0,3,0,50,Quantit√© limit√©e !,elimfashionstore,purple,https://contestimg.wish.com/api/webimage/5e9e8c496f15e20742bd4172-medium.jpg,21,1,21,"Summer,Plus Size,women dresses,Evening Dress,Dress,slim,casual dresses,Mini dress,beach dress,sleeveless,summer dresses,casual dress,slim dress,Shorts,Waist,short dress,Slim Fit,Women's Fashion,camouflage,Sleeveless dress,t,women dress,Women",CN,100,6126,50,0,Livraison standard,2,"92 % avis positifs (6,126 notes)",https://s3-us-west-1.amazonaws.com/sweeper-production-merchantimage/dp_550ab2be8e8def0b2c654d4b.jpg,SIZE XS
0,Summer Fashion Women Round Neck Sleeveless Pure Color Casual Pocket Dress,https://www.wish.com/c/5a3e27622b0a1c693c87e849,0,0,3.75,5853765779b45e0b58ad30f4,"Summer Fashion Women - Robe d√©contract√©e sans manches √† col rond sans manches, de couleur pure, √† poches",36,9,101,15,XMB mobile experience store,7,5a3e27622b0a1c693c87e849,2,4.152726560715335,0,29,0,50,Quantit√© limit√©e !,xmbmobileexperiencestore,black,https://contestimg.wish.com/api/webimage/5a3e27622b0a1c693c87e849-medium.jpg,44,1,219,"Round neck,Plus Size,Necks,Summer,Dress,Loose,Pocket,Women's Fashion,Fashion,Pure Color,sleeveless,Casual,Women",CN,1000,30643,2,0,Livraison standard,38,"89 % avis positifs (30,643 notes)",https://s3-us-west-1.amazonaws.com/sweeper-production-merchantimage/dp_5853765779b45e0b58ad30f4.jpg,S
0,Womens Summer Blouse Sexy Floral Shirt Loose Kimono Cardigan Casual Jacket Tops,https://www.wish.com/c/572981a997dc5f5d3c5f0651,0,0,4.14,5357bcf2bb72c5504882e889,Femmes Chemisier d'√©t√© Chemise Sexy Floral Chemise ample Cardigan Kimono Cardigan Casual Jacket Tops,1205,18,3125,305,ApparelHeaven,11,572981a997dc5f5d3c5f0651,3,4.2188662973274464,0,286,0,50,Quantit√© limit√©e !,primesalecolimited,pink,https://contestimg.wish.com/api/webimage/572981a997dc5f5d3c5f0651-medium.jpg,46,1,5759,"blouse,Summer,Fashion,Tops,kimono,Casual,Jacket,cardigan,Floral,sexy,summer tops",CN,20000,320031,50,1,Livraison standard,838,"90 % avis positifs (320,031 notes)",https://s3-us-west-1.amazonaws.com/sweeper-production-merchantimage/dp_5357bcf2bb72c5504882e889.jpg,S
0,New Women Fashion Two Piece Sunflower Printed Bikini Set Swimsuit Bathing Suit Beach Wear High Waist Bikini Swimwear,https://www.wish.com/c/5e6079792389e6a7ef176eed,0,0,3.38,577fb2b368116418674befd9,Nouvelles femmes mode deux pi√®ces tournesol imprim√© bikini ensemble maillot de bain maillot de bain plage porter taille haute bikini maillots de bain,6,5,24,2,keepahorse,5.74,5e6079792389e6a7ef176eed,2,4.137581777804454,0,15,0,50,Quantit√© limit√©e !,keepahorse,yellow,https://contestimg.wish.com/api/webimage/5e6079792389e6a7ef176eed-medium.jpg,30,1,58,"bathing suit,Fashion,high waist,Sunflowers,Beach,Waist,beach wear,Swimwear,Bikini,printed,Suits,Swimming,Women,Swimsuit,Women's Fashion,Two piece set",CN,100,66644,1,1,Livraison standard,11,"(66,644 notes)",https://s3-us-west-1.amazonaws.com/sweeper-production-merchantimage/dp_577fb2b368116418674befd9.jpg,XS
0,Hexagon Mulit Style Straw Bag Handbags Women Summer Rattan Bag Handmade Woven Beach Shoulder Messenger Bags,https://www.wish.com/c/5d2509a8b67b3f36849121a7,0,0,4.23,5b8deaae2eb51f6d30ff9a3d,Hexagon Mulit Style Mulit Sacs √† Main Sacs √† Paille Sacs √† Main en Rotin √ât√© Femme Sacs de Plage Tiss√©s √† la Main Sacs Messagers √âpaule de Plage,43,6,121,8,bagbagbagshop,7,5d2509a8b67b3f36849121a7,2,4.3324293785310735,0,11,0,50,Quantit√© limit√©e !,caeagle,green,https://contestimg.wish.com/api/webimage/5d2509a8b67b3f36849121a7-medium.jpg,36,1,207,"women bags,beachbag,strawbag,pursesampwallet,Shoulder Bags,Handmade,fashion bag,minibag,Bags,Crossbody Bag,Summer,Handbags,Women's Fashion,Beach,woven,Women",CN,1000,4425,50,1,Livraison standard,24,"93 % avis positifs (4,425 notes)",https://s3-us-west-1.amazonaws.com/sweeper-production-merchantimage/dp_5b8deaae2eb51f6d30ff9a3d.jpg,Pack of 1
0,Women Fashion Summer Dress Butterfly Print Sleeveless Short O-neck Mini Dress Above Knee Casual Loose Plus Size Button Pockets Dress Size S-5XL,https://www.wish.com/c/5d79d8dc6607933421ffa6a4,0,0,3.03,58c910072be00b51c601ccee,Femmes Mode Robe D'√©t√© Papillon Imprimer Sans Manches Court O-cou Mini Robe Au-dessus Du Genou Casual L√¢che Plus La Taille Poches Boutons Robe Taille S-5XL,20,8,32,12,BigHero,9,5d79d8dc6607933421ffa6a4,3,4.057185405807893,0,34,0,50,Quantit√© limit√©e !,bighero,yellow,https://contestimg.wish.com/api/webimage/5d79d8dc6607933421ffa6a4-medium.jpg,41,1,124,"butterfly,Summer,Plus Size,butterflydre,Mini,fashion dress,Dress,Mini dress,beach dress,Fashion,knee,Casual,casual dress,Shorts,button,summer dress,Women's Fashion,Sleeveless dress,Print,sleeveless,Women,loose dress",CN,1000,6715,50,1,Livraison standard,26,"86 % avis positifs (6,715 notes)",https://s3-us-west-1.amazonaws.com/sweeper-production-merchantimage/dp_58c910072be00b51c601ccee.jpg,S
0,2019 New Fashion Spring Summer Women's Long Pants Short Sleeves Off Shoulder Jumpsuit,https://www.wish.com/c/5cbd345663e9171f9180b06d,0,0,3.8,55c8a4c33a698c6010edcd9e,2019 nouvelle mode printemps √©t√© femmes pantalons longs manches courtes hors √©paule combinaison,422,11,932,151,Smart Home International Co.Ltd,12,5cbd345663e9171f9180b06d,3,4.1214837434884135,0,244,0,50,Quantit√© limit√©e !,smarthomeinternationalcoltd,black,https://contestimg.wish.com/api/webimage/5cbd345663e9171f9180b06d-medium.jpg,49,1,2066,"Summer,Shorts,Sleeve,pants,Spring,Loose,short sleeves,Long pants,Fashion,off shoulder,black,Causal,Women Fashion,jumpsuit",CN,20000,55670,25,1,Livraison standard,317,"88 % avis positifs (55,670 notes)",https://s3-us-west-1.amazonaws.com/sweeper-production-merchantimage/dp_55c8a4c33a698c6010edcd9e.jpg,M
0,Women Fashion Short Jumpsuit Spaghetti Strap Sleeveless Rompers Summer One Piece Set Casual Summer Outfits,https://www.wish.com/c/5e4267d60640954a435e64f5,0,0,4.26,5d462e58f320403871a78593,Femmes Mode Combinaison Courte Spaghetti Strap Sans Manches Barboteuses D'√©t√© Une Pi√®ce Ensemble Casual Tenues D'√©t√©,14,6,30,1,chooop,7,5e4267d60640954a435e64f5,2,3.837956204379562,0,3,0,50,Quantit√© limit√©e !,chooop,armygreen,https://contestimg.wish.com/api/webimage/5e4267d60640954a435e64f5-medium.jpg,31,1,53,"Summer,Shorts,Women,shortromper,Spaghetti,onepiece,Spaghetti Strap,One-Piece Suits,shortjumpsuit,Women's Fashion,Fashion,Casual,summerjumpsuit,sleeveless,Rompers,women Jumpsuit,playsuit,jumpsuit",CN,100,2055,50,0,Livraison standard,5,"81 % avis positifs (2,055 notes)",https://s3-us-west-1.amazonaws.com/sweeper-production-merchantimage/dp_5d462e58f320403871a78593.jpg,S
0,Plus Size Fashion Women Summer Casual Tank Tops Loose Beach Blouses Sleeveless Bohemia Printed Cotton Beach T Shirt,https://www.wish.com/c/5e686ce3e1cc2837f55f4401,0,0,3.74,566a25e33a698c1f131fd872,Grande taille mode femmes √©t√© d√©bardeurs d√©contract√©s chemisiers de plage en vrac sans manches boh√™me imprim√© coton plage t-shirt,8,13,25,4,CVhart,7,5e686ce3e1cc2837f55f4401,2,3.9494216129818764,0,7,0,50,Quantit√© limit√©e !,cvhart,pink,https://contestimg.wish.com/api/webimage/5e686ce3e1cc2837f55f4401-medium.jpg,41,1,54,"bohemia,Summer,Plus Size,Loose,tank top,Women's Fashion,Fashion,sleeveless tops,Summer Fashion,Casual,Cotton,blouse,beachtshirt,Tank,Shirt,Tops,boho,women shirt,sleeveless,Women,Beach,printed",CN,1000,36913,50,1,Livraison standard,10,"83 % avis positifs (36,913 notes)",https://s3-us-west-1.amazonaws.com/sweeper-production-merchantimage/dp_566a25e33a698c1f131fd872.jpg,S
0,MXNINA  Sexy Women's Summer Casual Sleeveless Evening Party Backless Beachwear Mini Dress wmnC16122400387E21,https://www.wish.com/c/5936611a08f45940ce8b5e01,0,0,3.51,57c306d73a698c06f98ed450,MXNINA  Sexy Women's Summer Casual Sleeveless Evening Party Backless Beachwear Mini Dress wmnC16122400387E21,10,21,17,8,SKATE,9,5936611a08f45940ce8b5e01,3,4.113869950137377,0,6,0,50,Quantit√© limit√©e !,skate,green,https://contestimg.wish.com/api/webimage/5936611a08f45940ce8b5e01-medium.jpg,34,1,47,"Summer,womens dresses,Mini,Patchwork,fashion dress,Dress,Mini dress,Women's Fashion,Women S Clothing,backless,sexy,party,Casual,sleeveless",CN,100,9827,7,0,Livraison standard,6,"87 % avis positifs (9,827 notes)",https://s3-us-west-1.amazonaws.com/sweeper-production-merchantimage/dp_57c306d73a698c06f98ed450.jpg,M
0,Women's Fashion Short Sleeve Round Collar Summer Tank Tops Feather Print T-shirt,https://www.wish.com/c/5d11c1a359a267782799345b,0,0,4.21,546d44001280fa3ce1bf80fa,Mode f√©minine √† manches courtes col rond D√©bardeurs T-shirt imprim√© plumes,20,17,60,5,HUASHU co. ltd.,12,5d11c1a359a267782799345b,3,3.9103428069147377,0,5,0,50,Quantit√© limit√©e !,huashucoltd,white,https://contestimg.wish.com/api/webimage/5d11c1a359a267782799345b-medium.jpg,43,1,103,"Summer,Collar,Fashion,Tank,Sleeve,Women Vest,Round Collar,Tops,T Shirts,tank top,short sleeves,Women's Fashion,Shorts,featherprint,Print,sleeveless,feather,Casual",CN,1000,20478,50,0,Livraison standard,13,"82 % avis positifs (20,478 notes)",https://s3-us-west-1.amazonaws.com/sweeper-production-merchantimage/dp_546d44001280fa3ce1bf80fa.jpg,M
0,Women Casual Tank Tops Hollow Out Cross Tee Shirt Summer Sleeveless Halter Loose Tunic Tops Vest,https://www.wish.com/c/5cedf538a1e74b7cfd5974ab,0,0,4.13,570ceafac277d445e3cbebe5,Femme D√©bardeur d√©contract√© D√©bardeur Dessus T-shirt Croix Creuse T-shirt √ât√© Halter Sans Manches Tunique D√©gag√©e Dessus Veste,296,7,705,79,Excellent Fashion Store,8,5cedf538a1e74b7cfd5974ab,2,4.053017944535074,0,70,0,50,Quantit√© limit√©e !,excellentfashionstore,grey,https://contestimg.wish.com/api/webimage/5cedf538a1e74b7cfd5974ab-medium.jpg,31,1,1312,"Women Vest,Vest,Fashion,Halter,Women Blouse,summer t-shirts,Cross,Women's Fashion,Summer,Casual T-Shirt,tunic,short sleeve shirt,Casual,Women,blouse women,Tops & Blouses,Shirt,Short Sleeve Blouses,Tops,Blouses & Shirts,sleeveless,Short Sleeve T-Shirt,Tank",CN,10000,7356,50,0,Livraison standard,162,"86 % avis positifs (7,356 notes)",https://s3-us-west-1.amazonaws.com/sweeper-production-merchantimage/dp_570ceafac277d445e3cbebe5.jpg,XS
0,2019 New Fashion Summer Women Casual Dress Round Neck Loose Big Swing Skirt Sleeveless Soild Color Beach dress,https://www.wish.com/c/5cd3e32fd908537780580e43,0,0,3.61,557ed5b886d66519ff242099,2019 New Fashion Summer Women Casual Dress Round Neck Round Neck Loose Big Swing Skirt Sleeveless Soild Color Robe de plage de couleur douce,434,5,981,220,redisland,5.74,5cd3e32fd908537780580e43,1,4.153665091898569,0,363,0,50,Quantit√© limit√©e !,redisland,white,https://contestimg.wish.com/api/webimage/5cd3e32fd908537780580e43-medium.jpg,50,1,2366,"Summer,Fashion,Necks,Skirts,Dress,Loose,Women's Fashion,Round neck,beach dress,sleeveless,black dress,Beach,Casual,Women",CN,10000,59903,1,1,Livraison standard,368,"88 % avis positifs (59,903 notes)",https://s3-us-west-1.amazonaws.com/sweeper-production-merchantimage/dp_557ed5b886d66519ff242099.jpg,M
0,2018 New Fashion Women Casual Playsuit Ladies Jumpsuit Romper Summer Floral Playsuit Brand New (3 Colors),https://www.wish.com/c/5aec22cec25735338c544690,0,0,3.72,55e7e41e606d0a18fdfc67d1,2018 New Fashion Women Casual Playsuit Dames Jumpsuit Romper Summer Floral Playsuit Brand New (3 Colors),201,10,447,81,besagift,11,5aec22cec25735338c544690,2,4.268002261895145,0,144,0,50,Quantit√© limit√©e !,besagift,white,https://contestimg.wish.com/api/webimage/5aec22cec25735338c544690-medium.jpg,25,1,1008,"Summer,Shorts,Rompers,Casual,Ladies,Women's Fashion,Fashion,off shoulder,sexy,Floral,sleeveless,Women,Beach,playsuit,jumpsuit",CN,5000,61895,50,0,Livraison standard,135,"(61,895 notes)",https://s3-us-west-1.amazonaws.com/sweeper-production-merchantimage/dp_55e7e41e606d0a18fdfc67d1.jpg,M
0,Plus Size Women Floral Dress Spaghetti Strap Collect Waist A-line Summer Mini Dress,https://www.wish.com/c/5ad8a6fda7d4844b7e6d9e5e,0,0,4.14,5620c3b23a698c4bc7d17e8c,Grande Taille Femme Robe Fleurale Robe Collect Largeur Taille Mini Robe d'√©t√© √† bretelles spaghetti et fines bretelles,776,11,1950,184,Chen Tidal current clothing,12,5ad8a6fda7d4844b7e6d9e5e,3,3.9848368423748783,0,222,0,50,Quantit√© limit√©e !,chentidalcurrentclothing,navyblue,https://contestimg.wish.com/api/webimage/5ad8a6fda7d4844b7e6d9e5e-medium.jpg,30,1,3560,"Mini,Plus Size,Print Dresses,Waist,Summer,Dress,Mini dress,Women's Fashion,vestido,Floral,Spaghetti,Women",CN,10000,19521,50,0,Livraison standard,428,"85 % avis positifs (19,521 notes)",https://s3-us-west-1.amazonaws.com/sweeper-production-merchantimage/dp_5620c3b23a698c4bc7d17e8c.jpg,S
0,Summer Fashion Women's Jumpsuit Floral Print Sleeveless 5 Colors Romper,https://www.wish.com/c/5a6ac97e5983516f0f0dbf85,0,0,4.12,56c3c5d830d9795c3bad3124,Mode d'√©t√© pour dames Jumpsuit sans manches imprim√© floral 5 couleurs Romper,606,11,1573,135,Teamwolf,13,5a6ac97e5983516f0f0dbf85,3,4.147841677010067,0,188,0,50,Quantit√© limit√©e !,teamwolf,black,https://contestimg.wish.com/api/webimage/5a6ac97e5983516f0f0dbf85-medium.jpg,36,1,2901,"Summer,trousers,Floral print,Fashion,Print,Long pants,Women Clothing,Floral,sleeveless,sexy jumpsuit,Jumpers,Clothing,Rompers,jumpsuit",CN,10000,14502,50,0,Livraison standard,399,"(14,502 notes)",https://s3-us-west-1.amazonaws.com/sweeper-production-merchantimage/dp_56c3c5d830d9795c3bad3124.jpg,M
0,Black and White Boho Maxi Long Dress,https://www.wish.com/c/57d25f8877ba9b045e02cd12,0,0,3.42,57875ba40cb30d38ba46f57d,Femmes robe d'√©t√© sexy Boho Maxi longue robe de soir√©e robe de plage robe d'√©t√© MEL,1403,37,2679,793,Melantha,11,57d25f8877ba9b045e02cd12,3,4.310188055383343,0,1404,0,50,Quantit√© limit√©e !,melantha,black,https://contestimg.wish.com/api/webimage/57d25f8877ba9b045e02cd12-medium.jpg,39,1,7596,"Summer,slim dress,sundress,long dress,fashion dress,Dress,summer dress,beach dress,longmaxiskirt,boho,Party Dress,boho dress,party,sexy,women dress,Beach,Women's Fashion,geometricpattern,evening party dress,Women",CN,20000,58068,50,0,Livraison standard,1317,"91 % avis positifs (58,068 notes)",https://s3-us-west-1.amazonaws.com/sweeper-production-merchantimage/dp_57875ba40cb30d38ba46f57d.jpg,S
0,Casual Summer Women's Romper Short Lace Playsuit V-Neck Slim Ladies Jumpsuit,https://www.wish.com/c/5e21311e2e434806022e2d5f,0,0,3.46,5817f156d8ef7848c3b400cc,Combishort d√©contract√© √† manches courtes en dentelle pour femmes,5,89,8,0,ocean5for8ZH,11,5e21311e2e434806022e2d5f,2,4.38569196276921,0,5,0,50,Quantit√© limit√©e !,ocean5for8zh,black,https://contestimg.wish.com/api/webimage/5e21311e2e434806022e2d5f-medium.jpg,52,1,24,"Summer,Women Rompers,Shorts,women beachwear,womenonepiece,lace top,lace bralette top,womensjumpsuitsromper,V-neck,Rompers,women summer tops,lace lingerie,Women S Clothing,Ladies,jumpsuit,slim,Casual,Lace",CN,100,73595,50,0,Livraison standard,6,"93 % avis positifs (73,595 notes)",https://s3-us-west-1.amazonaws.com/sweeper-production-merchantimage/dp_5817f156d8ef7848c3b400cc.jpg,S
0,Summer New Tank Top Women's Fashion Loose Casual Sleeveless Design Floral Printed Spaghetti Strap Tank Top Plus Size  Tops  S-6XL,https://www.wish.com/c/5d0b0ac9fdbec0744e2584a9,0,0,3.96,5acaf29d5ebcfd72403106a8,Summer New Tank Top Women's Fashion Loose Casual Sleeveless Design Floral Printed Spaghetti Strap Tank Top Plus Size  Tops  S-6XL,26,6,86,8,Suyi Technology,5.65,5d0b0ac9fdbec0744e2584a9,2,4.045170200666179,0,16,0,50,Quantit√© limit√©e !,greatexpectationstechnology,black,https://contestimg.wish.com/api/webimage/5d0b0ac9fdbec0744e2584a9-medium.jpg,23,1,164,"Summer,Plus Size,Tank,Tops,Spaghetti Strap,tank top,floralprinted,Women's Fashion,Fashion,Design,printed,Floral,sleeveless,Spaghetti,Casual",CN,1000,12309,17,1,Livraison standard,28,"86 % avis positifs (12,309 notes)",https://s3-us-west-1.amazonaws.com/sweeper-production-merchantimage/dp_5acaf29d5ebcfd72403106a8.jpg,M
0,2018 T Shirts + Shorts Brand Clothing Tshirt Men Homme Letter Printed Basketball Running Sports Set T-shirt Suit Male,https://www.wish.com/c/575f968e71c7c161e321f107,0,0,3.87,56effd3864d54a58a619bdb1,2018 T-shirts + shorts T-shirts de marque T-shirt Hommes V√™tements de marque T-shirt Homme Lettre Imprim√© Basketball Sports Running Set T-shirt de course √† pied Costume Hommes,56,31,178,24,wuguipanwei2016,12,575f968e71c7c161e321f107,3,4.007824726134586,0,45,0,50,Quantit√© limit√©e !,wuguipanwei2016,green,https://contestimg.wish.com/api/webimage/575f968e71c7c161e321f107-medium.jpg,12,1,344,"bathing suit,Fashion,Sports & Outdoors,summersuit,Men,pantssuit,T Shirts,Basketball,Men's pants,printed,Sport,Swimming suit,tshirtsuit,Shorts,Shirt,Clothing,track suit,Fashion Suits,Running,Men's Fashion,Sport Suits,Suits",CN,1000,639,50,0,Expediere Standard,41,85% Feedback pozitiv (639 rating),https://s3-us-west-1.amazonaws.com/sweeper-production-merchantimage/dp_56effd3864d54a58a619bdb1.jpg,XS
0,Woman's New Summer Women Stretchy Camisole  Spaghetti Strap Long Tank Top Slip Mini Dress Fashion Sleeveless Backless Low Cut Top Camisole Spaghetti Strap Dress Beach Dress 7 Color,https://www.wish.com/c/5c6a62559d67d46bb6ce5d70,0,0,3.82,57ee6909567a8d101913df98,Nouvelle femme d'√©t√© pour femmes Camisole extensible Spaghetti Strap Long Tank Top Slip Mini Dress Fashion Sans manches Backless Low Cut Top Camisole Spaghetti Strap Dress Beach Dress 7 Color,101,11,189,30,Oneshopp,12,5c6a62559d67d46bb6ce5d70,3,3.978864638096755,0,49,0,50,Quantit√© limit√©e !,oneshopp,red,https://contestimg.wish.com/api/webimage/5c6a62559d67d46bb6ce5d70-medium.jpg,41,1,428,"Mini,Strapless Dress,Fashion,Tank,Spaghetti,Summer,Beach,Tops,Spaghetti Strap,beach dress,tank top,bodycon,Women's Fashion,Sleeveless dress,backless,Dress,sleeveless,Mini dress,slim,Casual,Women",CN,1000,18831,50,0,Livraison standard,59,"(18,831 notes)",https://s3-us-west-1.amazonaws.com/sweeper-production-merchantimage/dp_57ee6909567a8d101913df98.jpg,S
0,New Fashion Women's Summer Drawstring Pants  Loose Casual Shorts Elastic Waistband Lacing Short Pants,https://www.wish.com/c/5cc7b4c98b94871ee33b33b6,0,0,3.67,5acaf29d5ebcfd72403106a8,New Fashion Women's Summer Drawstring Pants  Loose Casual Shorts Elastic Waistband Lacing Short Pants,3,6,7,1,Suyi Technology,7,5cc7b4c98b94871ee33b33b6,2,4.045170200666179,0,2,0,50,Quantit√© limit√©e !,greatexpectationstechnology,khaki,https://contestimg.wish.com/api/webimage/5cc7b4c98b94871ee33b33b6-medium.jpg,23,1,18,"drawstringpant,Summer,Shorts,Bottom,pants,Loose,Short pants,Women's Fashion,Plus Size,Fashion,Casual,Women",CN,100,12309,44,1,Livraison standard,5,"86 % avis positifs (12,309 notes)",https://s3-us-west-1.amazonaws.com/sweeper-production-merchantimage/dp_5acaf29d5ebcfd72403106a8.jpg,M
0,New Fashion Women Round Neck Summer Polka Dot Printed Sleeveless Dress Ladies Casual Mid-length Plus Size Dress,https://www.wish.com/c/5d78933775c1735981cf4c25,0,0,3.48,55c8a4c33a698c6010edcd9e,"Nouvelle mode femmes col rond √©t√© polka dot robe sans manches imprim√©e dames occasionnel mi-longueur, plus la taille robe",4,4,9,5,Smart Home International Co.Ltd,3.86,5d78933775c1735981cf4c25,1,4.1214837434884135,0,3,0,50,Quantit√© limit√©e !,smarthomeinternationalcoltd,green,https://contestimg.wish.com/api/webimage/5d78933775c1735981cf4c25-medium.jpg,49,1,23,"Summer,Plus Size,Necks,Dress,Polkas,Round neck,Women's Fashion,Fashion,polka dot,Sleeveless dress,Ladies,sleeveless,printed,Casual,Women",CN,100,55670,1,1,Livraison standard,2,"(55,670 notes)",https://s3-us-west-1.amazonaws.com/sweeper-production-merchantimage/dp_55c8a4c33a698c6010edcd9e.jpg,S
0,Women's Fashion Plus Size Casual Short Sleeve Loose Summer Print V-neck Dress,https://www.wish.com/c/5ea8dcee238ae108c8a57aa1,0,0,3.29,5533c83986ff95173dc017d0,"Mode f√©minine, plus la taille d√©contract√©e √† manches courtes l√¢che d'√©t√© imprimer robe √† col en V",12,8,40,11,shuilingjiao international trade company,9,5ea8dcee238ae108c8a57aa1,3,4.080890773644167,0,26,0,50,Quantit√© limit√©e !,shuilingjiaointernationaltradecompany,red,https://contestimg.wish.com/api/webimage/5ea8dcee238ae108c8a57aa1-medium.jpg,28,1,99,"Summer,Plus Size,Sleeve,Dress,Loose,short sleeves,V-neck,Shorts,Women's Fashion,Fashion,Print,Casual,Women Fashion",CN,1000,88193,44,1,Livraison standard,10,"(88,193 notes)",https://s3-us-west-1.amazonaws.com/sweeper-production-merchantimage/dp_5533c83986ff95173dc017d0.jpg,Size S
0,Plus Size XS-6XL Summer Women Round Neck Sleeveless Dress Casual Floral Printed Dress Slim Flower Dresses,https://www.wish.com/c/5d550011680f557c89bb4406,0,0,4,547465748edcfa6ceab14f70,Plus la taille XS-6XL d'√©t√© femmes col rond robe sans manches d√©contract√© imprim√© floral robe Slim fleur robes,59,10,103,7,wofu_network_technology,11,5d550011680f557c89bb4406,3,4.004267016780864,0,19,0,50,Quantit√© limit√©e !,huaracheairfactory,white,https://contestimg.wish.com/api/webimage/5d550011680f557c89bb4406-medium.jpg,36,1,221,"Summer,floralprinteddres,Dress,slim,Floral dress,Women's Fashion,Plus Size,womensleevelessdres,printed,Floral,Casual,Women,dressforwomen,Flowers,Necks,casualwomendres,summer dress,summersleeveelessdres,Sleeveless dress,Round neck,dress slim,sleeveless",CN,1000,73119,6,0,Livraison standard,33,"87 % avis positifs (73,119 notes)",https://s3-us-west-1.amazonaws.com/sweeper-production-merchantimage/dp_547465748edcfa6ceab14f70.jpg,M
0,Mother and Daughter Casual Boho Stripe Maxi Dress Mom & Kids Matching Set Outfit,https://www.wish.com/c/5b3dd07615e1a54aa30f6117,0,0,4.09,5817f156d8ef7848c3b400cc,"Robe longue √† rayures Boho M√®re et Fille M√®re et Fille, assortie √† l'ensemble pour maman et enfants",113,168,288,26,ocean5for8ZH,12,5b3dd07615e1a54aa30f6117,3,4.38569196276921,0,42,0,50,Quantit√© limit√©e !,ocean5for8zh,black,https://contestimg.wish.com/api/webimage/5b3dd07615e1a54aa30f6117-medium.jpg,52,1,529,"Women S Clothing,maxi summer dresses,Mother,Dress,motherdaughterdresse,momandkid,Outfits,Casual,boho,Women's Fashion,Sleeveless dress,striped dress,Stripes,women dress,boho dress,motherdaughtermatchingclothe,kids",CN,5000,73595,50,0,Livraison standard,60,"93 % avis positifs (73,595 notes)",https://s3-us-west-1.amazonaws.com/sweeper-production-merchantimage/dp_5817f156d8ef7848c3b400cc.jpg,4-5 Years
0,Mayzero New Summer Women Long Beach Dress Boho Floral Print Sexy Split,https://www.wish.com/c/5a211e5fb2f70e3fded9ea3e,1,0,3.92,53e03f56ff4d6d36d2285ab0,Mayzero New Summer Femmes Robe Long Beach Boho Imprim√© Floral Sexy Split,2091,106,4974,655,hechuang1001,11,5a211e5fb2f70e3fded9ea3e,3,4.0686645678077555,0,1021,1,50,Quantit√© limit√©e !,hechuang1001,white,https://contestimg.wish.com/api/webimage/5a211e5fb2f70e3fded9ea3e-medium.jpg,45,1,10150,"Summer,Floral print,long dress,Beach,Dress,boho,Print,beach dress,off shoulder,splits,sexy,Floral,maxi dress,Ladies,Women's Fashion,Women",CN,20000,25093,12,1,Livraison standard,1409,"86 % avis positifs (25,093 notes)",https://s3-us-west-1.amazonaws.com/sweeper-production-merchantimage/dp_53e03f56ff4d6d36d2285ab0.jpg,S
